{
  "version": "0.1",
  "symbol_id": "symbol-chair-plan",
  "object_type": "chair",
  "archetype": "seating",
  "view": "plan",
  "footprint": { "width_mm": 520, "depth_mm": 520, "height_mm": 900 },
  "orientation": { "rotation_deg": 0, "facing": "north" },
  "parts": [
    { "part_id": "chair-outline", "kind": "outline", "role": "primary_shell" },
    { "part_id": "chair-seat", "kind": "seat_split", "role": "seat_zone", "params": { "span_ratio": 0.38 } },
    { "part_id": "chair-facing", "kind": "orientation_marker", "role": "facing", "params": { "span_ratio": 0.3, "axis": "y" } }
  ],
  "readability_constraints": {
    "min_part_count": 3,
    "requires_non_bbox_parts": true,
    "allows_text_labels": false,
    "allows_dimensions": false
  },
  "fallback_policy": { "mode": "symbol_readable", "reason": "chair seating glyph" }
}
